{
  "version": 1,
  "project": {
    "id": "cs-platform-2",
    "name": "智能客服平台 2.0",
    "owner": "陈思",
    "members": ["刘洋", "赵敏", "郑雨", "周航"],
    "start": "2026-08-01",
    "end": "2026-12-20",
    "status": "on_track",
    "goal": {
      "title": "全量发布",
      "description": "覆盖 80% 常见咨询，人工转接率下降 30%"
    }
  },
  "milestones": [
    {
      "id": "m1",
      "title": "需求评审通过",
      "planned_date": "2026-08-15",
      "done_date": "2026-08-15",
      "status": "done",
      "owner": "陈思",
      "summary": "PRD 评审通过，确定覆盖 80% 常见咨询的目标与验收口径。",
      "side": "auto",
      "attachments": [
        { "title": "智能客服 2.0 · PRD", "url": "https://example.com/docs/prd", "type": "doc" }
      ]
    },
    {
      "id": "m2",
      "title": "技术方案定稿",
      "planned_date": "2026-09-05",
      "done_date": "2026-09-05",
      "status": "done",
      "owner": "刘洋",
      "summary": "检索增强架构评审通过，拆分为检索、生成、评测三个模块。",
      "side": "auto",
      "attachments": [
        { "title": "技术方案：检索增强架构", "url": "https://example.com/docs/arch", "type": "doc" },
        { "title": "架构评审记录", "url": "https://example.com/docs/arch-review", "type": "doc" }
      ]
    },
    {
      "id": "m3",
      "title": "召回率达标 91%",
      "planned_date": "2026-10-25",
      "done_date": "2026-10-20",
      "status": "done",
      "owner": "赵敏",
      "summary": "检索召回率从 84% 提升到 91%，提前 5 天超过 90% 的阶段目标。",
      "side": "auto",
      "attachments": [
        { "title": "召回率评测报告", "url": "https://example.com/sheets/recall", "type": "sheet" }
      ]
    },
    {
      "id": "m4",
      "title": "核心开发完成",
      "planned_date": "2026-11-02",
      "status": "in_progress",
      "owner": "刘洋",
      "summary": "检索、生成、评测三个模块完成开发并合入主干。",
      "side": "auto",
      "attachments": []
    },
    {
      "id": "m5",
      "title": "灰度上线",
      "planned_date": "2026-11-15",
      "status": "planned",
      "owner": "陈思",
      "summary": "在 2 个客服组灰度，观察自助解决率与转人工率。",
      "side": "auto",
      "attachments": [
        { "title": "灰度发布 Checklist", "url": "https://example.com/docs/gray-checklist", "type": "doc" }
      ]
    },
    {
      "id": "m6",
      "title": "效果复盘",
      "planned_date": "2026-12-05",
      "status": "planned",
      "owner": "陈思",
      "summary": "",
      "side": "auto",
      "attachments": []
    }
  ],
  "updates": [
    {
      "id": "u1",
      "date": "2026-08-28",
      "author": "刘洋",
      "title": "技术选型调研",
      "content": "完成三套检索方案对比，倾向向量 + 关键词混合检索。",
      "status": "normal",
      "risk": "",
      "attachments": []
    },
    {
      "id": "u2",
      "date": "2026-09-18",
      "author": "赵敏",
      "title": "评测集搭建",
      "content": "整理 1,200 条真实咨询作为评测集，完成首轮基线测试。",
      "status": "normal",
      "risk": "",
      "attachments": []
    },
    {
      "id": "u3",
      "date": "2026-09-29",
      "author": "郑雨",
      "title": "工作台交互稿",
      "content": "客服工作台交互稿评审通过。",
      "status": "normal",
      "risk": "",
      "attachments": [
        { "title": "工作台交互稿", "url": "https://example.com/design/workbench", "type": "design" }
      ]
    },
    {
      "id": "u4",
      "date": "2026-10-09",
      "author": "刘洋",
      "title": "检索模块联调",
      "content": "检索服务与客服工作台打通，可在测试环境体验。",
      "status": "normal",
      "risk": "",
      "attachments": []
    },
    {
      "id": "u5",
      "date": "2026-10-21",
      "author": "赵敏",
      "title": "知识清洗第一批",
      "content": "完成知识库清洗第一批 3,200 条。",
      "status": "risk",
      "risk": "标注人力不足，需业务方 11 月前协调 2 名标注同学。",
      "attachments": []
    },
    {
      "id": "u6",
      "date": "2026-10-24",
      "author": "刘洋",
      "title": "压测完成",
      "content": "问答服务压测完成，P99 延迟 1.2s，下一步做缓存优化。",
      "status": "normal",
      "risk": "",
      "attachments": []
    }
  ]
}
